Title,Author,Date,Rating
FACT CHECK: Hindi ninakaw ni Kris Aquino ang mga alahas ni Imelda Marcos,Author not found,2023-05-19,FALSE
FALSE: Litrato ng Poong Nazareno na ginawang 'kakampink',Author not found,2022-04-19,FALSE
FACT CHECK: China calls for end to Israel-Hamas conflict,Author not found,2023-10-26,FALSE
FACT CHECK: Video of 'Israel-Palestine conflict' is just a game simulation,Author not found,2023-10-11,FALSE
FACT CHECK: Altered photo shows Lionel Messi holding Israeli flag,Author not found,2023-11-03,ALTERED
FALSE: Pagmamay-ari ng mga Marcos ang shares ng mga Duavit sa GMA,Author not found,2022-05-26,FALSE
FACT CHECK: Hontiveros not part of 2014 PhilHealth bonus scandal,Author not found,2023-09-22,FALSE
FACT CHECK: House Bill 6522 doesn't remove the right of Filipinos to decide on their health,Author not found,2023-02-06,FALSE
ALTERED: Pinagalitan ng pari sina Robredo at Pangilinan sa isang misa,Author not found,2022-05-02,FALSE
FALSE: Hot coconut water kills cancer cells,Author not found,2022-07-05,FALSE
TheÂ  Philippines was not called a 'superpower' under Marcos' leadership,Author not found,2022-08-23,FALSE
"FALSE: Bo Phoi Tritydo cures lung diseases, such as pneumonia and bronchitis",Author not found,2022-04-19,FALSE
FACT CHECK: Philippines didn't buy Swedish-made helicopter,Author not found,2023-02-20,FALSE
FACT CHECK: Fake ads for hair growth product use Doc Willie Ong's videos,Author not found,2023-08-11,FALSE
FACT CHECK: Sara Duterte didn't say K-12 was  abolished in DepEd's 2023 report,Author not found,2023-04-05,FALSE
FACT CHECK: No super typhoons in PH Area of Responsibility so far in August,Author not found,2023-08-08,FALSE
FACT CHECK: Kaduda-duda ang 'Marcos account' sa Switzerland,Author not found,2023-01-27,FALSE
Hindi libre ang pambansang pabahay na programa ng gobyerno,Author not found,2022-10-18,FALSE
FACT CHECK: TUPAD is not a cash aid or scholarship program for students,Author not found,2024-05-13,FALSE
FACT CHECK: Colombia did not experience a 'zombie virus' outbreak,Author not found,2023-04-04,FALSE
FACT CHECK: PH has yet to acquire its first submarine,Author not found,2023-07-26,FALSE
"FACT CHECK: Diabetes 'cure' ad uses stock photo, name of dead doctor",Author not found,2023-07-11,FALSE
FACT CHECK: Cardinal Tagle denies endorsing Barley Grass Powder,Author not found,2023-08-14,FALSE
FACT CHECK: Revised K-10 curriculum is part of K to 12 program,Author not found,2023-08-15,FALSE
FACT CHECK: PH didn't buy 24 A-10 fighter jets from the US,Author not found,2023-05-03,FALSE
FALSE: Ni-recruit ni Chad Booc ang mga kabataang katutubong kasama niya sa Cebu,Author not found,2022-03-25,FALSE
FALSE: Kinumpirma ni Duterte na makukulong nang 10 taon si Hontiveros,Author not found,2022-03-08,FALSE
FACT CHECK: Marcos' last will had nothing to do with Estrada's impeachment,Author not found,2023-01-16,FALSE
FACT CHECK: Marcos did not discuss family's gold bullion account at 42nd ASEAN Summit,Author not found,2023-05-19,FALSE
Robredo did not visit DSWD unannounced,Author not found,2022-08-31,FALSE
FACT CHECK: Video of 'destruction' of US ship based on fake Reuters report,Author not found,2023-08-07,FALSE
FALSE: US makes dicyanin dye illegal because of its supernatural properties,Author not found,2022-06-13,FALSE
FACT CHECK: PH not a military superpower in Asia,Author not found,2024-02-26,FALSE
FALSE: Marcos Jr. holds the Guinness World Record for longest motorcade,Author not found,2022-04-01,FALSE
FACT CHECK: Video falsely links 2011 Japan tsunami to recent quake,Author not found,2024-01-06,FALSE
"FACT CHECK: PH, US did not sink 15 Chinese ships off Pag-asa Island",Author not found,2023-12-03,FALSE
FACT CHECK: Video of military parade not from AFP's 87th anniversary parade,Author not found,2022-12-21,FALSE
FACT CHECK: No reports of EU ship attacking China in Ayungin Shoal,Author not found,2023-08-03,FALSE
"Video of 'Japan Military Forces' taken in 2015, not an attack vs North Korea",Author not found,2022-11-30,FALSE
FACT CHECK: 'Marcos account' interest will not be used for NKTI,Author not found,2023-02-08,FALSE
FACT CHECK: Wala sa huling habilin ni Marcos ang banggit ng ginto o sambayanang Pilipino,Author not found,2022-12-21,FALSE
"FACT CHECK: Doc Willie Ong's name, videos used in fake ads for Glufarelin",Author not found,2023-07-21,FALSE
FACT CHECK: US request to host Afghans not meant to invite attack on PH,Author not found,2023-06-26,FALSE
FACT CHECK: No PH acquisition of warship from Turkey,Author not found,2023-08-18,FALSE
FALSE: Binanatan ng propesor si Robredo dahil sa paunang paghingi ng mga tanong,Author not found,2022-02-21,FALSE
FACT CHECK: Video of gold bars taken at US Mint's gold and silver vault,Author not found,2023-01-25,FALSE
"Pilipinas ang tunay, legal na pangalan ng bansa ng mga Pilipino, hindi Maharlika",Author not found,2022-12-12,FALSE
FACT CHECK: Hindi unang beses nagkaroon ng Vin d'Honneur sa MalacaÃ±ang,Author not found,2023-02-03,FALSE
FALSE: Video ng pagpapahayag ni Duterte ng suporta para kay Robredo,Author not found,2022-05-08,FALSE
FACT CHECK: UK not donating latest aircraft carrier to PH,Author not found,2024-05-16,FALSE
FALSE: Ilocos Norte government backs petition to declare Robredo 'persona non grata',Author not found,2022-03-16,FALSE
FACT CHECK: DSWD has no Noche Buena giveaways,Author not found,2023-10-11,FALSE
FALSE: Bongbong Marcos walang kaso ng human rights sa Amerika,Author not found,2022-03-05,FALSE
FACT CHECK: BBM is not the world's richest president,Author not found,2023-02-18,FALSE
FALSE: Epsom salt bath cures cancer,Author not found,2022-07-06,FALSE
FACT CHECK: Ad of unregistered nut product misrepresents endorsement by Filipino doctor,Author not found,2023-03-03,FALSE
"Media has reported on the planned MRT line, which will connect NCR and Bulacan",Author not found,2022-10-17,FALSE
FALSE: 2-month-old baby dies after receiving Pfizer COVID-19 vaccine,Author not found,2022-07-12,FALSE
FACT CHECK: No online sale of lost baggage at NAIA â MIAA,Author not found,2023-11-29,FALSE
"MISSING CONTEXT: Sinabi ni Robredo, ''Pag naging pangulo ako walang magbabago'",Author not found,2022-01-26,MISSING CONTEXT
FACT CHECK: Wala pang anunsiyo ng CHED scholarship program para sa AY 2024-2025,Author not found,2024-04-23,FALSE
FACT CHECK: Marcos not the smartest world leader with superior IQ in 2022,Author not found,2023-03-17,FALSE
Marcos does not own SM malls,Author not found,2022-10-17,FALSE
FACT CHECK: Bukidnon concertgoers passed off as Duterte's Tagum 'peace rally' attendees,Author not found,2024-04-15,FALSE
FACT CHECK: Landbank's Gawad Patnubay scholarship program ended in 2022,Author not found,2024-01-19,FALSE
"FACT CHECK: Ad uses AI-edited videos of Henry Omaga-Diaz, Doc Willie Ong",Author not found,2024-01-16,FALSE
FACT CHECK: Eye 'cure' ad uses AI-manipulated news report,Author not found,2024-05-29,FALSE
FACT CHECK: No Senate death sentence for employers of Filipino domestic worker,Author not found,2023-09-19,FALSE
FACT CHECK: Walang kaugnayan sa 'listahan ng smugglers' ang resignation ni Clarita Carlos,Author not found,2023-01-25,FALSE
FACT CHECK: Brazil floods not due to mockery of Christ at 2023 carnival skit,Author not found,2023-03-17,FALSE
FACT CHECK: Gumugulong pa rin ang murder complaint laban kay Bantag,Author not found,2023-01-12,FALSE
There is no Tropical Storm Samuel approaching Luzon,Author not found,2022-12-23,FALSE
"MISSING CONTEXT: CCLEx, TPLEx accomplished under Duterte administration",Author not found,2021-09-01,MISSING CONTEXT
FALSE: Sinabi ng anak na dating drug addict si Marcos Jr.,Author not found,2022-04-05,FALSE
FACT CHECK: Quote cards about diabetes used to promote Glufarelin fabricated,Author not found,2023-04-06,FALSE
Hindi nakasaad sa Treaty of Paris na benepisyaryo ang Pilipinas ng lahat ng kayamanan sa mundo,Author not found,2022-10-04,FALSE
FALSE: Sinabi ni Isko Moreno na siya ang nagpagawa ng Manila Golden Mosque,Author not found,2022-03-15,FALSE
FALSE: Tanggal na bilang Comelec Commissioner si Rowena Guanzon,Author not found,2022-01-31,FALSE
FACT CHECK: NAIA was built during the administration of Pres. Ferdinand E. Marcos #FactsFirstPH - Baguio Chronicle,Baguio Chronicle,2022-07-10,FALSE
FACT CHECK: The Angat Buhay NGO is backed by the CPP-NPA-NDF #FactsFirstPH - Baguio Chronicle,Baguio Chronicle,2022-07-08,FALSE
FACT CHECK: Glufarelin milk can treat diabetes by controlling blood sugar levels #FactsFirstPH - Baguio Chronicle,Baguio Chronicle,2022-07-20,FALSE
FACT CHECK: VP Robredo calls the Barzagas traitors and idiots #FactsFirstPH - Baguio Chronicle,Baguio Chronicle,2022-04-13,FALSE
FACT CHECK: SMNI wins prestigious award for its presidential debate coverage #FactsFirstPH - Baguio Chronicle,Baguio Chronicle,2022-02-28,MISSING CONTEXT
FACT CHECK: VP Robredo expressed support for the Church of Godâs discrimination against trans influencer Sass Sasot #FactsFirstPH - Baguio Chronicle,Baguio Chronicle,2022-06-24,FALSE
FACT CHECK: Leni liable for graft over Angat Buhay NGO #FactsFirstPH - Baguio Chronicle,Baguio Chronicle,2022-06-17,FALSE
FACT CHECK: Sandro Marcos wants OFWs to pay tax for gov't debt #FactsFirstPH - Baguio Chronicle,Baguio Chronicle,2022-03-29,FALSE
FACT CHECK: Oplan Baklas #FactsFirstPH - Baguio Chronicle,Baguio Chronicle,2022-02-21,FALSE
FACT CHECK: Sara Duterte is the first incumbent mayor to become VP and the first from Mindanao #FactsFirstPH - Baguio Chronicle,Baguio Chronicle,2022-06-19,FALSE
FACT CHECK: 100 billion people attended BBM Grand Rally 2022 #FactsFirstPH - Baguio Chronicle,Baguio Chronicle,2022-03-25,SATIRE
FACT CHECK: Rappler violated the Constitution #FactsFirstPH - Baguio Chronicle,Baguio Chronicle,2022-07-12,MISSING CONTEXT
"FACT CHECK: Plaza Miranda, Rano Massacre were handiworks of the CPP-NPA-NDF, necessitating the declaration of Martial Law #FactsFirstPH - Baguio Chronicle",Baguio Chronicle,2022-07-10,FALSE
"Pinklawans defined as anti-progress, CPP-NPA supporters in Urban Dictionary - Baguio Chronicle",Baguio Chronicle,2022-05-30,FALSE
"FACT CHECK: Ferdinand âBongbongâ R. Marcos, Jr. was welcomed by 2 million Pangasinenses #FactsFirstPH - Baguio Chronicle",Baguio Chronicle,2022-02-28,FALSE
"FACT CHECK: Aquinos responsible for selling land, uses West Philippine sea as Dumpsite (Panambak) #FactsFirstPH - Baguio Chronicle",Baguio Chronicle,2022-06-28,FALSE
FACT CHECK: VP Robredo cannot remember pieces of legislation she filed as Camarines Sur Representative #FactsFirstPH - Baguio Chronicle,Baguio Chronicle,2022-05-31,FALSE
FACT CHECK: Ferdinand Marcos Sr. is a hero because he was buried at the Libingan ng Mga Bayani in 2016 #FactsFirstPH - Baguio Chronicle,Baguio Chronicle,2022-06-30,FALSE
FACT CHECK: BBM to change the National Language back to Ilocano #FactsFirstPH - Baguio Chronicle,Baguio Chronicle,2022-03-29,FALSE
FACT CHECK: Baguio journalist is CPP-NPA-NDF member #FactsFirstPH - Baguio Chronicle,Baguio Chronicle,2022-08-15,FALSE
FACT CHECK: Darryl Yap is listed by Forbes as among the most obnoxious people under 30 worldwide #FactsFirstPH - Baguio Chronicle,Baguio Chronicle,2022-06-10,SATIRE
FACT CHECK: Robredo says thousands of soldiers are worthy of sacrifice for Scarborough Shoal #FactsFirstPH - Baguio Chronicle,Baguio Chronicle,2022-04-09,FALSE
FACT CHECK: Willie Revillame to lead ABS-CBN after buying the frequency on which the media corporation broadcasted #FactsFirstPH - Baguio Chronicle,Baguio Chronicle,2022-06-28,FALSE
FACT CHECK: The government is giving incentives to those who received defective COVID vaccines #FactsFirstPH - Baguio Chronicle,Baguio Chronicle,2022-05-30,FALSE
"FACT CHECK: Patricia Non, the pioneer of the community pantry movement, is part of the CPP-NPA #FactsFirstPH - Baguio Chronicle",Baguio Chronicle,2022-05-31,FALSE
FACT CHECK - COVID-19 Vaccine Booster Shots are dangerous #FactsFirstPH - Baguio Chronicle,Baguio Chronicle,2022-02-14,FALSE
"FACT CHECK: VP Leni Robredo comments on the cost of the Philippine Arena, an indoor stadium owned by Iglesia Ni Cristo (INC) #FactsFirstPH - Baguio Chronicle",Baguio Chronicle,2022-04-08,FALSE
FACT CHECK: Daughter of Kiko and Sharon comes out as a lesbian #FactsFirstPH - Baguio Chronicle,Baguio Chronicle,2022-06-21,FALSE
FACT CHECK: Guinness World Records removing Marcos entry absolves dynasty #FactsFirstPH - Baguio Chronicle,Baguio Chronicle,2022-03-17,FALSE
"FACT CHECK: Jillian Robredo heckling was due to impoliteness, blocking #FactsFirstPH - Baguio Chronicle",Baguio Chronicle,2022-04-27,FALSE
FACT CHECK - Robredo is keeping campaign donations #FactsFirstPH - Baguio Chronicle,Baguio Chronicle,2022-02-14,UNAVAILABLE
FACT CHECK: Robredo threatens chaos if defeated #FactsFirstPH - Baguio Chronicle,Baguio Chronicle,2022-04-27,FALSE
FACT CHECK: BBM has done nothing since 2016 nat'l elections #FactsFirstPH - Baguio Chronicle,Baguio Chronicle,2022-03-15,TRUE
FACT CHECK - Robredo says there is no COVID vaccine in 2022 #FactsFirstPH - Baguio Chronicle,Baguio Chronicle,2022-02-14,UNAVAILABLE
FACT CHECK - Robredo is keeping campaign donations #FactsFirstPH - Baguio Chronicle,Baguio Chronicle,2022-02-14,UNAVAILABLE
FACT CHECK: Sagada oranges are really orange in hue and come from a province in China #FactsFirstPH - Baguio Chronicle,Baguio Chronicle,2022-08-15,FALSE
FACT CHECK: Ateneo gunman was supposed to be the new DOH Secretary #FactsFirstPH - Baguio Chronicle,Baguio Chronicle,2022-07-29,FALSE
FACT CHECK: Marcos says 2022 election first where WPS is major issue #FactsFirsPH - Baguio Chronicle,Baguio Chronicle,2022-02-28,FALSE
FACT CHECK: Atty. Thorrsson Keith leads in a survey for the Benguet congressional race #FactsFirstPH - Baguio Chronicle,Baguio Chronicle,2022-03-30,FALSE
"FACT CHECK: 10 âBuild, Build, Build' projects in locos region under Duterte #FactsFirstPH - Baguio Chronicle",Baguio Chronicle,2022-02-14,UNAVAILABLE
Outgoing VP Leni Robredo to form âAngat Buhay Allianceâ with the Communist Party of the Philippines (CPP) and New Peopleâs Army (NPA) - Baguio Chronicle,Baguio Chronicle,2022-06-22,FALSE
FACT CHECK: Art Weave is the first ever to feature an art collaboration between artists and weavers in the Philippines #FactsFirstPH - Baguio Chronicle,Baguio Chronicle,2022-07-30,FALSE
FACT CHECK: Build Build Build begins work on longest tunnel road project in Davao #FactsFirstPH - Baguio Chronicle,Baguio Chronicle,2022-03-17,MISSING CONTEXT
FACT CHECK: Marcos takes lead in the March Social Weather Stations (SWS) presidential survey #FactsFirstPH - Baguio Chronicle,Baguio Chronicle,2022-04-16,FALSE
FACT CHECK: Robredo maligned Filipino seamen for inadequate skills #FactsFirstPH - Baguio Chronicle,Baguio Chronicle,2022-03-24,FALSE
"FACT CHECK: Masagana 99 improved food production, prices #FactsFirstPH - Baguio Chronicle",Baguio Chronicle,2022-02-24,FALSE
FACT CHECK: VP Leni Robredo eats at a restaurant affiliated with Joma Sison #FactsFirstPH - Baguio Chronicle,Baguio Chronicle,2022-04-07,FALSE
FACT CHECK: UP Prof. Clarita Carlos criticized VP Leni Robredo for saying that she is running only because she doesnât want BBM to win #FactsFirstPH - Baguio Chronicle,Baguio Chronicle,2022-02-28,MISSING CONTEXT
FACT CHECK: Robredo seeks coalition gov't with CPP/NPA/NDF #FactsFirstPH - Baguio Chronicle,Baguio Chronicle,2022-03-06,FALSE
FACT CHECK: Marcos preferred bet of 9/10 Pinoys abroad #FactsFirstPH - Baguio Chronicle,Baguio Chronicle,2022-02-28,FALSE
FACT CHECK: The number of votes do not match the number of registered voters #FactsFirstPH - Baguio Chronicle,Baguio Chronicle,2022-05-30,FALSE
FACT CHECK: Robredo has a team of photo manipulators in sorties #FactsFirstPH - Baguio Chronicle,Baguio Chronicle,2022-03-18,FALSE
"FACT CHECK: The Carmelite nuns of Jaro, Iloilo eagerly watched âMaid in Malacanangâ #FactsFirstPH - Baguio Chronicle",Baguio Chronicle,2022-08-15,FALSE
FACT CHECK: Quiboloy says UP and other SUCs are ârecruitment agenciesâ for the CPP-NPA-NDF #FactsFirstPH - Baguio Chronicle,Baguio Chronicle,2022-07-10,FALSE
FACT CHECK: Aika Robredo admitted through a tweet that she was the woman in a sex video #FactsFirstPH - Baguio Chronicle,Baguio Chronicle,2022-04-15,FALSE
FACT CHECK: Maharlika TV claims fact checker claims Bongbong Marcos is a drug addict - Baguio Chronicle,Baguio Chronicle,2022-04-05,FALSE
FACT CHECK: âDilawansâ are habitual fake news peddlers #FactsFirstPH - Baguio Chronicle,Baguio Chronicle,2022-06-21,FALSE
FACT CHECK: Ateneo University Press placed anti-Marcos book on sale due to a lack of buyers #FactsFirstPH - Baguio Chronicle,Baguio Chronicle,2022-07-31,FALSE
"FACT CHECK: VP Leni paid Pantaleon ""Bebot"" Alvarez to declare his full support #FactsFirstPH - Baguio Chronicle",Baguio Chronicle,2022-03-29,FALSE
FACT CHECK: Cory failed to operate Bataan nuclear plant #FactsFirstPH - Baguio Chronicle,Baguio Chronicle,2022-02-28,FALSE
FACT CHECK - The COMELEC office is lit up with the colors of the Uniteam tandem #FactsFirstPH - Baguio Chronicle,Baguio Chronicle,2022-02-18,TRUE
FACT CHECK - Robredo says there is no COVID vaccine in 2022 #FactsFirstPH - Baguio Chronicle,Baguio Chronicle,2022-02-14,UNAVAILABLE
FACT CHECK: BBM-Sara tandem prophesied by the countryâs coat of arms #FactsFirstPH - Baguio Chronicle,Baguio Chronicle,2022-03-15,FALSE
FACT CHECK: The PCGG stole the Marcos familyâs âprivate wealthâ #FactsFirstPH - Baguio Chronicle,Baguio Chronicle,2022-07-16,FALSE
FACT CHECK: The International Criminal Court is backed by âDilawansâ#FactsFirstPH - Baguio Chronicle,Baguio Chronicle,2022-07-12,FALSE
FACT CHECK: Marcos Jr. takes lead in Hongkong and Qatar exit polls #FactsFirstPH - Baguio Chronicle,Baguio Chronicle,2022-04-13,FALSE
FACT CHECK: Imelda's acquittal means Marcoses are innocent of theft #FactsFirstPH - Baguio Chronicle,Baguio Chronicle,2022-02-25,FALSE
"FACT CHECK: PNoy administration incurred a debt of P1.37 trillion, while the national debt increased to P12.68 trillion under the Duterte admin #FactsFirstPH - Baguio Chronicle",Baguio Chronicle,2022-06-03,TRUE
"FACT CHECK: The Igorot Stone Kingdom is located in Banaue, Ifugao #FactsFirstPH - Baguio Chronicle",Baguio Chronicle,2022-07-17,FALSE
FACT CHECK: Marcos's world record for theft #FactsFirstPH - Baguio Chronicle,Baguio Chronicle,2022-02-21,TRUE
"FACT CHECK: President Duterte claimed that âMaharlikaâ means serenity and peace, proposed to change the countryâs name #FactsFirstPH - Baguio Chronicle",Baguio Chronicle,2022-04-30,FALSE
FACT CHECK: Premium rice selling for P20 a kilo in Quezon City #FactsFirstPH - Baguio Chronicle,Baguio Chronicle,2022-05-28,FALSE
FACT CHECK: Photo uploaded on Twitter intentionally makes the water of Manila Bay appear unflattering #FactsFirstPH - Baguio Chronicle,Baguio Chronicle,2022-06-30,FALSE
FACT CHECK: COA flagged Davao City for assets #FactsFirstPH - Baguio Chronicle,Baguio Chronicle,2022-03-30,TRUE
FACT CHECK: Senator Go co-authored act providing honoraria to youth officials #FactsFirstPH - Baguio Chronicle,Baguio Chronicle,2022-05-26,MISSING CONTEXT
"FACT CHECK: Prince Charles, heir apparent to the British throne, was happy that Ferdinand Marcos Jr. is the new president of the Philippines #FactsFirstPH - Baguio Chronicle",Baguio Chronicle,2022-05-25,FALSE
FACT CHECK: Rice prices in Bohol reach P19.00/kilo #FactsFirstPH - Baguio Chronicle,Baguio Chronicle,2022-06-28,FALSE
FACT CHECK: Mark Villar started the 7.17 km Urdaneta City Bypass Road #FactsFirstPH - Baguio Chronicle,Baguio Chronicle,2022-03-21,FALSE
FACT CHECK: Senator-elect Robin Padilla claims PNoy did nothing for education and employment during his term #FactsFirstPH - Baguio Chronicle,Baguio Chronicle,2022-05-29,FALSE
FACT CHECK: NPA rebels surrendered to president-elect Marcos Jr.âs administration #FactsFirstPH - Baguio Chronicle,Baguio Chronicle,2022-06-27,FALSE
FACT CHECK: VP Robredo claims that her election loss was a blessing in disguise #FactsFirstPH - Baguio Chronicle,Baguio Chronicle,2022-06-21,MISSING CONTEXT
FACT CHECK: A much-stronger earthquake will return this Wednesday evening in Abra #FactsFirstPH - Baguio Chronicle,Baguio Chronicle,2022-07-27,FALSE
FACT CHECK: Duterte favors an Ilocano replacement #FactsFirstPH - Baguio Chronicle,Baguio Chronicle,2022-03-06,FALSE
"FACT CHECK: Sandro Marcos says father ""need not shake hands with common people"" #FactsFirstPH - Baguio Chronicle",Baguio Chronicle,2022-02-27,FALSE
FACT CHECK: Students required to join the Leni Rally in Cebu #FactsFirstPH - Baguio Chronicle,Baguio Chronicle,2022-04-25,FALSE
FACT CHECK: UN leaders were impressed by President Bongbong Marcos Jr. and praised his talent and intelligence #FactsFirstPH - Baguio Chronicle,Baguio Chronicle,2022-07-31,FALSE
FACT CHECK: Kuwait celebrates the win of BBM-Sara in the 2022 Election #FactsFirstPH - Baguio Chronicle,Baguio Chronicle,2022-05-12,FALSE
FACT CHECK: Robin Padilla embarrasses Senator Drilon for his âtrivialâ legislative accomplishments #FactsFirstPH - Baguio Chronicle,Baguio Chronicle,2022-05-25,MISLEADING
"FACT CHECK: The new â±1,000 polymer banknote won't be legal tender when folded #FactsFirstPH - Baguio Chronicle",Baguio Chronicle,2022-07-13,FALSE
FACT CHECK: TUPAD payouts are from caretaker Eric Yap #FactsFirstPH - Baguio Chronicle,Baguio Chronicle,2022-03-09,FALSE
FACT CHECK: Marcos avoided mentioning Ninoy Aquino in his SONA #FactsFirstPH - Baguio Chronicle,Baguio Chronicle,2022-07-31,TRUE
FACT CHECK: Angat Buhay program flagged for missing documents #FactsFirstPH - Baguio Chronicle,Baguio Chronicle,2022-03-09,MISSING CONTEXT
"FACT CHECK: Aika Robredo faked sex video fiasco, Leni should apologize #FactsFirstPH - Baguio Chronicle",Baguio Chronicle,2022-04-23,FALSE
FACT CHECK: Ilocos Norte 1st District Rep. Sandro Marcos will pass a law extending the terms of the president and vice president #FactsFirstPH - Baguio Chronicle,Baguio Chronicle,2022-07-10,FALSE
"FACT CHECK: Leni Robredo lied about being a Professor in Economics, according to an International Relations expert #FactsFirstPH - Baguio Chronicle",Baguio Chronicle,2022-04-24,FALSE
FACT CHECK: Ferdinand Marcos Sr. and his family calmly left MalacaÃ±ang palace during the EDSA revolution #FactsFirstPH - Baguio Chronicle,Baguio Chronicle,2022-08-15,FALSE
FACT CHECK: Marcos avoiding handshakes after injury from a wrist slash #FactsFirstPH - Baguio Chronicle,Baguio Chronicle,2022-02-20,FALSE
FACT CHECK: The singer Cher endorsed VP Leni Robredo #FactsFirstPH - Baguio Chronicle,Baguio Chronicle,2022-02-21,MISSING CONTEXT
FACT CHECK: Angat Buhay Foundation intends to overthrow Marcos presidency #FactsFirstPH - Baguio Chronicle,Baguio Chronicle,2022-06-25,FALSE
FACT CHECK: BBM authored the Philippine Archipelagic Baselines Law #FactsFirstPH - Baguio Chronicle,Baguio Chronicle,2022-03-13,FALSE
FACT CHECK: Imee Marcos fabricated her graduation from four different schools #FactsFirstPH - Baguio Chronicle,Baguio Chronicle,2022-07-12,TRUE
FACT CHECK: Bongbong tells the DFA to repatriate Pinoys in Ukraine immediately #FactsFirstPH - Baguio Chronicle,Baguio Chronicle,2022-02-27,MISSING CONTEXT
FACT CHECK: NTF-ELCAC claims Baguio City Mayorâs directive was intended to protect communist rebels #FactsFirstPH - Baguio Chronicle,Baguio Chronicle,2022-03-21,FALSE
FACT CHECK: Luke Espiritu is recruiting Kristy Halili on his team #FactsFirstPH - Baguio Chronicle,Baguio Chronicle,2022-03-21,UNAVAILABLE
FACT CHECK: Live crocodile caught at Marikina River and paraded on top of a trailer in Antipolo #FactsFirstPH - Baguio Chronicle,Baguio Chronicle,2022-06-27,FALSE
FACT CHECK: Jay Sonza says Ninoy Aquino Jr. and Joma Sison were the masterminds of the 1971 Plaza Miranda bombing #FactsFirstPH - Baguio Chronicle,Baguio Chronicle,2022-07-20,FALSE
FACT CHECK: Facebook post claims Maria Ressa was sentenced to 15 years for cyber libel #FactsFirstPH - Baguio Chronicle,Baguio Chronicle,2022-07-30,FALSE
FACT CHECK: Leni-Kiko supporters recruited Marikina Science High School students in an election-related event #FactsFirstPH - Baguio Chronicle,Baguio Chronicle,2022-05-12,FALSE
FACT CHECK: Maria Ressa has paid more bail than Imelda Marcos #FactsFirstPH - Baguio Chronicle,Baguio Chronicle,2022-06-21,TRUE
FACT CHECK: BBM win already lowers rice prices #FactsFirstPH - Baguio Chronicle,Baguio Chronicle,2022-05-25,FALSE
"FACT CHECK: P10,000 incentive to those who will register for National ID #FactsFirstPH - Baguio Chronicle",Baguio Chronicle,2022-06-10,FALSE
FACT CHECK: Opposition leader Ninoy Aquino was an opportunistic politician by taking advantage of the deteriorating health of the late President Marcos #FactsFirstPH - Baguio Chronicle,Baguio Chronicle,2022-06-19,FALSE
FACT CHECK: Domogan perpetually disqualified from public office #FactsFirstPH - Baguio Chronicle,Baguio Chronicle,2022-05-12,MISSING CONTEXT
FACT CHECK: Philippine Inflation Rate rises to 6.1% #FactsFirstPH - Baguio Chronicle,Baguio Chronicle,2022-07-08,TRUE
FACT CHECK: Poong Nazareno dressed in pink in support of VP Leni Robredoâs presidential candidacy #FactsFirstPH - Baguio Chronicle,Baguio Chronicle,2022-04-15,FALSE
FACT CHECK - Marcos is an economist #FactsFirstPH - Baguio Chronicle,Baguio Chronicle,2022-02-15,FALSE
FACT CHECK: BBM developed the famous Ilocos wind farms #FactsFirstPH - Baguio Chronicle,Baguio Chronicle,2022-03-13,FALSE
FACT CHECK: Electric Cooperatives are inefficient parts of energy industry contributing to higher power costs #FactsFirstPH - Baguio Chronicle,Baguio Chronicle,2022-03-18,FALSE
FACT CHECK: 73 out of 81 of all governors are backing BBM-Sara #FactsFirstPH - Baguio Chronicle,Baguio Chronicle,2022-04-13,UNAVAILABLE
FACT CHECK: More people trust SMNI #FactsFirstPH - Baguio Chronicle,Baguio Chronicle,2022-05-30,MISSING CONTEXT
