Title,Author,Date,Rating
FACT CHECK: Mauling of senior citizen reported by Tacloban Today never happened â police,Author not found,2023-12-26,FALSE
FACT CHECK: Janno Gibbs not involved in death of father Ronaldo Valdez,Author not found,2023-12-24,FALSE
FACT CHECK: DOLE-NLRC has no scholarship program,Author not found,2023-12-20,FALSE
FACT CHECK: DPWH projects not funded by Marcos gold account's earned interest,Author not found,2023-03-16,FALSE
Goutto effervescent tablet does not treat gout,Author not found,2022-09-12,FALSE
FACT CHECK: Hindi kinumpirma ni Sara Duterte na bubuwagin ang K-12,Author not found,2023-01-17,FALSE
LGU ang mangangasiwa sa pagtukoy ng mga benepisyaryo ng pambansang pabahay,Author not found,2022-10-26,FALSE
FACT CHECK: Air defense system from Israel already delivered to the Philippines,Author not found,2023-10-07,FALSE
FALSE: Media did not report on collapsed footbridge in Zamboanga City,Author not found,2021-07-02,FALSE
FACT CHECK: Video doesn't show 'USS Ronald Reagan' in Mindanao,Author not found,2023-06-28,FALSE
FACT CHECK: Video shows altered 2021 photo of Chinese ship in Indonesia,Author not found,2023-09-29,FALSE
FACT CHECK: No law passed abolishing K-12 program,Author not found,2023-02-22,FALSE
FACT CHECK: No schedule yet for the release of SSS pensioners' 13th-month pay,Author not found,2023-11-13,FALSE
"FACT CHECK: Si Remulla pa rin ang DOJ secretary, hindi si Roque",Author not found,2022-12-23,FALSE
Cagan Nano does not cure hepatitis,Author not found,2022-09-07,FALSE
Hindi sa blogging site magpapasa ng aplikasyon para sa DOST scholarship,Author not found,2022-11-01,FALSE
FACT CHECK: Doc Willie Ong video promoting varicose veins cream is fake,Author not found,2024-02-29,FALSE
"FACT CHECK: P10,000 teaching allowance bill not yet passed into law",Author not found,2023-02-09,FALSE
FACT CHECK: Mayon Volcano alert status has not been raised to Level 4,Author not found,2023-06-17,FALSE
PH sovereign fund bill filed in 2016 specified a management structure,Author not found,2022-12-08,FALSE
FACT CHECK: Ferdinand E. Marcos' 'Wonder Boy letter' has dubious details,Author not found,2023-11-07,FALSE
Mainstream media reported the Saudi foreign minister's courtesy call on Marcos,Author not found,2022-10-06,FALSE
FACT CHECK: No retaliation vs China in South China Sea joint drills,Author not found,2023-09-06,FALSE
Mainstream media covers the Pambansang Pabahay program,Author not found,2022-11-30,FALSE
FACT CHECK: Doc Liza Ong doesn't endorse unregistered anti-itch cream,Author not found,2024-02-13,FALSE
FACT CHECK: Power Mac Center does not sell GT20 Ultra smartwatches,Author not found,2023-10-13,FALSE
FACT CHECK: Noynoy's choice to use 'Simeon' as middle name unrelated to Ninoy's death,Author not found,2023-02-21,FALSE
FACT CHECK: Roque not only Filipino accredited as ICC counsel,Author not found,2024-01-08,FALSE
FALSE: Sakay ng yate si Robredo bago lumipat ng bangka papuntang Basilan,Author not found,2022-03-23,FALSE
MISSING CONTEXT: Magtatayo ng Marcos Foundation si Bongbong dahil sa habilin ng ama,Author not found,2022-05-31,MISSING CONTEXT
Various media reported on groundbreaking ceremony of QC housing project,Author not found,2022-10-28,FALSE
FACT CHECK: No senator identified as behind alleged leak of executive session information,Author not found,2023-11-17,FALSE
FACT CHECK: 'Di totoong bagong adviser ni Marcos si Duterte,Author not found,2023-02-07,FALSE
Mainstream media reported Marcos' meeting with World Bank,Author not found,2022-09-27,FALSE
FACT CHECK: Doc Willie Ong not endorsing unregistered gout ointment,Author not found,2024-02-07,FALSE
FACT CHECK: Ex-president Aquino is not alive and hiding in the US,Author not found,2023-05-23,FALSE
FALSE: Inilampaso ni Robin Padilla ang mga news anchor ng GMA sa interbiyu,Author not found,2022-05-19,FALSE
FACT CHECK: Hindi pa rin malaya si De Lima,Author not found,2023-01-30,FALSE
FACT CHECK: No such thing as Marcos gold account in Australia,Author not found,2023-09-13,FALSE
FACT CHECK: Walang banggit ng Pilipinas sa bibliya,Author not found,2023-08-22,FALSE
FACT CHECK: Envy Apple Cider Vinegar Gummies not endorsed by Doc Willie Ong,Author not found,2024-04-11,FALSE
FACT CHECK: 'Di sinabi sa education report 2023 na tutuldukan na ang K-12 program,Author not found,2023-02-03,FALSE
FALSE: Walang scam sa coco levy trust fund noong panahon ni Marcos,Author not found,2022-03-25,FALSE
FALSE: Kinausap ng mga dilawan si John Oliver para talakayin niya ang eleksiyon ng Filipinas,Author not found,2022-05-27,FALSE
FACT CHECK: PH not under martial law after China water cannon incident,Author not found,2023-08-17,FALSE
FACT CHECK: Surigao del Sur Governor Ayec Pimentel is alive,Author not found,2024-04-02,FALSE
FACT CHECK: Santo NiÃ±o de CebÃº not an image of Mesopotamian god Tammuz,Author not found,2023-03-20,FALSE
FACT CHECK: Kailangan ng panibagong batas upang mabuwag ang K-12,Author not found,2023-01-16,FALSE
MISSING CONTEXT: Mayroong unliquidated transactions ang Angat Buhay program,Author not found,2022-05-19,MISSING CONTEXT
FACT CHECK: No prediction of two earthquakes to hit Bohol,Author not found,2023-11-06,FALSE
"FACT CHECK: Photos, videos of Kanlaon Volcano spewing fountain of lava are fake",Author not found,2024-06-06,FALSE
"FALSE: 500,000 ang dumalo sa Marcos-Duterte rally sa Las Pinas at sa caravan mula Muntinlupa",Author not found,2022-03-15,FALSE
"FACT CHECK: No current disbarment case at SC vs De Lima, Diokno",Author not found,2023-07-06,FALSE
FACT CHECK: Gmail is not shutting down,Author not found,2024-02-28,FALSE
"FACT CHECK: Video shows a Japanese F-2 fighter plane, not a Chinese jet",Author not found,2023-05-26,FALSE
FACT CHECK: No active fault line along Cagayan de Oro,Author not found,2023-01-07,FALSE
FALSE: Dok Apo Healing Wonder Drops cures glaucoma,Author not found,2022-07-20,FALSE
"FACT CHECK: Video report by TV anchors on 'free' necklace is fake, AI manipulated",Author not found,2024-01-10,FALSE
"Walang rehistrasyon online ang DSWD para sa P10,000, P30,000 na ayuda",Author not found,2022-11-29,FALSE
FALSE: Magnetic therapy healthcare bracelet improves sperm count,Author not found,2022-07-18,FALSE
FALSE: Bidyo ng pagsigaw ng 'Marcos pa rin' sa Robredo proclamation rally,Author not found,2022-02-10,FALSE
FACT CHECK: Tulfo remains a sitting senator,Author not found,2024-03-20,FALSE
FALSE: Ferdinand Marcos wrote the 1973 Constitution,Author not found,2022-01-25,FALSE
FACT CHECK: Ad of unregistered product misrepresents endorsement by Kris Aquino,Author not found,2023-03-14,FALSE
"FACT CHECK: No P10,000 cash aid for all senior citizens from DSWD",Author not found,2024-04-03,FALSE
No tsunami alert raised after Luzon earthquake,Author not found,2022-07-27,FALSE
FACT CHECK: Roque not replacing Romualdez as new House speaker,Author not found,2024-04-05,FALSE
Teddy Baguilat did not name the Liberal Party's presidential bet for 2028,Author not found,2022-09-14,FALSE
"FACT CHECK: NIH, Leachon do not endorse Glufarelin as diabetes cure",Author not found,2023-03-27,FALSE
FACT CHECK: US didn't give USS Omaha ship as gift to PH,Author not found,2023-12-22,FALSE
MISSING CONTEXT: Sequestered assets ng mga Marcos hindi pruweba ng pagnanakaw,Author not found,2022-02-14,MISSING CONTEXT
FACT CHECK: Doc Willie Ong doesn't endorse Nasure Colostrum Milk,Author not found,2023-12-24,FALSE
FACT CHECK: Doc Willie Ong doesn't endorse Lung Gold Milk,Author not found,2023-12-18,FALSE
Calamansi and Snowbear cannot cure cough and cold,Author not found,2022-08-02,FALSE
FACT CHECK: No upcoming tropical cyclones in PH up until August 18,Author not found,2023-08-18,FALSE
FACT CHECK: Baggage handlers filmed hurling luggage are not Korean,Author not found,2024-01-04,FALSE
FACT CHECK: The PH hasn't purchased new Viper or Apache attack helicopters,Author not found,2023-02-20,FALSE
Hindi sa blogging site magpaparehistro para sa 4Ps,Author not found,2022-11-18,FALSE
FALSE: Sa Pasig City Hall quadrangle gaganapin ang rally ni Robredo,Author not found,2022-03-15,FALSE
FACT CHECK: No MalacaÃ±ang memo on salary deduction for gov't employees,Author not found,2023-02-20,FALSE
FALSE: Nahalal na bise presidente si Marcos Jr.,Author not found,2022-01-29,FALSE
Marburg virus cannot be activated thru 5G,Author not found,2022-08-12,FALSE
FACT CHECK: No US decision to deploy 180 nuclear warheads to deter North Korea,Author not found,2023-11-13,FALSE
FACT CHECK: 'MTRCB summons' for Vice Ganda came from satire account,Author not found,2023-11-01,SATIRE
FALSE: Napaiyak si Isko Moreno nang mapanood ang caravan ni Marcos Jr.,Author not found,2022-02-25,FALSE
FALSE: Marcos Jr. leads in Bloomberg survey on best candidate to lead economic recovery,Author not found,2022-03-20,FALSE
FACT CHECK: 'Diabetes cure' ad uses unrelated photo of World War II survivor,Author not found,2023-10-17,FALSE
FALSE: Kabataan Partylist nominee behind assassination threat vs Marcos Jr.,Author not found,2022-02-02,FALSE
FACT CHECK: CNN's Dr. Gomez 'does not promote any medication' for diabetes,Author not found,2023-04-06,FALSE
MISSING CONTEXT: Si Ferdinand Marcos ang gumawa ng batas para sa 13th-month pay,Author not found,2021-11-26,MISSING CONTEXT
Tropical Storm Luis was not projected to hit Luzon,Author not found,2022-09-29,FALSE
FALSE: Ibinalita ng ABS-CBN na araw-araw mag-eeroplano si Sara Duterte mula Davao patungong Manila,Author not found,2022-06-29,FALSE
FACT CHECK: Hontiveros not expelled from Senate over ICC probe resolution,Author not found,2023-12-05,FALSE
FACT CHECK: Ex-president Marcos was not founder of the Asian Development Bank,Author not found,2023-05-26,FALSE
FACT CHECK: Ex-president Marcos didn't provide blueprints for Bataan-Cavite Interlink Bridge project,Author not found,2023-05-02,FALSE
FACT CHECK: Kris Aquino did not steal Imelda Marcos' jewelry,Author not found,2023-04-03,FALSE
FACT CHECK: Fake quote from diabetes expert used to promote Glufarelin,Author not found,2023-07-11,FALSE
FALSE: Magnetic therapy insoles increase height,Author not found,2022-04-26,FALSE
FACT CHECK: Marcos Sr. Letter of Instruction prescribing distribution of gold does not exist,Author not found,2023-04-04,FALSE
FALSE: Ipinagbawal ni Ferdinand Marcos ang child labor,Author not found,2022-04-09,FALSE
"FACT CHECK: No P5,000 allowance for registered voters â DSWD",Author not found,2023-10-17,FALSE
"Canada, not Russia, is largest trading partner of the United States",Author not found,2022-11-25,FALSE
"FACT CHECK: Walang link mula sa DSWD para sa P5,000 ayuda",Author not found,2024-04-08,FALSE
FACT CHECK: No Palace proclamation declaring March 11 a regular holiday,Author not found,2024-03-09,FALSE
FACT CHECK: Chinese tourists increased under Marcos admin,Author not found,2024-04-17,MISSING CONTEXT
FALSE: Ang SPLAT Communications ay isang data analytics firm,Author not found,2022-03-01,FALSE
Spike proteins produced by COVID-19 vaccines are not toxic,Author not found,2022-09-06,FALSE
"FACT CHECK:  The Indonesian navy did not attack Chinese vessels on March 10, 2023",Author not found,2023-03-15,FALSE
ALTERED: Pangulong Duterte hawak ang UniTeam t-shirt,Author not found,2022-03-31,ALTERED
"FACT CHECK: Video shows Polish religious gathering, not pro-Israel rally",Author not found,2023-10-18,FALSE
FACT CHECK: Mati City not the only place with musical dancing fountain,Author not found,2023-04-12,FALSE
FACT CHECK: 'Video' of Israel-Hamas war uses clip from shooting game,Author not found,2023-10-29,FALSE
FACT CHECK: Post on job vacancies not from official DSWD page,Author not found,2024-03-14,FALSE
FALSE: Hindi ibinalita ang kalagayan ng Ilog Pasig sa ilalim nina Aquino at Duterte,Author not found,2022-06-03,FALSE
Leaders who attended the ASEAN Summit are not all members of a monarchy,Author not found,2022-11-15,FALSE
FACT CHECK: Marcoleta's Insistence That ABS-CBN's Closure Was Because Of Network's 'Sins' Needs Context,Katrina Hallare,2022-02-15,MISSING CONTEXT
FACT CHECK: Hindi galing sa 'wealth for humanity' ang pangkabuhayan at pamaskong handog ng Pangulo,Author not found,2022-12-23,FALSE
FACT CHECK: No statement from Tulfo on banning all products from China,Author not found,2023-08-16,FALSE
FALSE: Ngayon lang ulit nakapagpalipad ng aircraft ang Philippine Air Force,Author not found,2022-06-30,FALSE
FALSE: Retrato ng mas kakaunting dumalo sa Robredo rally sa Pasay,Author not found,2022-04-26,FALSE
FACT CHECK: Risa Hontiveros not affiliated with CPP-NPA,Author not found,2023-09-10,FALSE
Mga reservist lang ang ipadadala ng gobyerno ng Russia sa kanilang partial mobilization,Author not found,2022-09-27,MISSING CONTEXT
FACT CHECK: Imposible ang 1.7 milyong toneladang Marcos gold sa China,Author not found,2023-01-05,FALSE
"FACT CHECK: San Miguel responsible for battery energy storage, not Marcos",Author not found,2023-04-14,FALSE
There is no evidence that Vicks VapoRub treats acne,Author not found,2022-10-19,FALSE
Napabulaanan na ang pagkakasangkot ni Hontiveros sa mga anomalya sa PhilHealth,Author not found,2022-11-21,FALSE
"FACT CHECK: No NATO attack vs Syria, Iran over Israel-Hamas war",Author not found,2023-11-06,FALSE
FACT CHECK: Philippines won't send military troops to Ukraine,Author not found,2023-01-30,FALSE
FALSE: Nagrerekrut ang ACT Teachers Party-List para sa CPP-NPA-NDF,Author not found,2022-04-16,FALSE
FACT CHECK: Report on US missiles hitting Chinese warship is fake,Author not found,2023-10-10,FALSE
Corvettes acquired by the PH are smaller than earlier Jose Rizal-class frigates,Author not found,2022-11-18,FALSE
FACT CHECK: Wala ng CBP magmula pa noong 1993; pinalitan na ng Bangko Sentral,Author not found,2023-02-06,FALSE
FACT CHECK: Caritas Philippines says no to Kaliwa Dam,Author not found,2023-03-01,ALTERED
MISSING CONTEXT: Sinabi ni Sharon Cuneta na si Robredo ang pangulong paniniwalaan ng NPA,Author not found,2022-03-15,MISSING CONTEXT
FACT CHECK: Gov't hasn't allocated P1 trillion for the National Food Security Convergence Program,Author not found,2023-05-17,FALSE
DepEd's proposed budget does not include  scrapping of the K to 12 Program,Author not found,2022-09-20,FALSE
"FACT CHECK: Context Of Leni Robredo's Quote On Biden, CIA Removed",Maxine Lagman,2022-03-09,MISSING CONTEXT
FALSE: Cebu Pacific gives cash gift for its 25th anniversary celebration,Author not found,2022-02-26,FALSE
FALSE: Coca-Cola partners with WHO for investment program,Author not found,2022-02-07,FALSE
FACT CHECK:Â  GCash 'advisory' on removal from app stores is fake,Author not found,2024-02-05,FALSE
FALSE: Pope Francis announces retirement,Author not found,2022-06-29,FALSE
FACT CHECK: MMDA's no contact apprehension policy still suspended,Author not found,2024-02-19,FALSE
"FACT CHECK: NAIA power outages due to 'inadequate maintenance,' not sabotage",Author not found,2023-06-10,FALSE
FACT CHECK: Hindi economic sabotage ang pagtutol sa proyekto ng gobyerno,Author not found,2022-12-24,FALSE
"Bilang pangulo, hindi huhulihin si Marcos sa Amerika dahil sa diplomatic immunity",Author not found,2022-09-21,MISSING CONTEXT
FACT CHECK: Marcos did not confront China over coral reef destruction,Author not found,2023-10-09,FALSE
MISSING CONTEXT: Duterte says COVID-19 booster shots not needed,Author not found,2022-01-24,MISSING CONTEXT
FALSE: 'Blot Echo Wind Map' predicts earthquakes,Author not found,2022-01-30,FALSE
"FACT CHECK: Video shows Indonesian Navy vessel, not a gift from Russia to PH",Author not found,2023-03-02,FALSE
Putting sliced onion in the sole cannot improve blood circulation,Author not found,2022-07-28,FALSE
FACT CHECK: Castro not suspended from House of Representatives,Author not found,2024-06-06,FALSE
FACT CHECK: Video does not show Chinese invasion of Taiwan,Author not found,2023-08-11,FALSE
Hindi deuterium gas ang huhukayin sa Liguasan Marsh,Author not found,2022-11-29,FALSE
FALSE: PH economy got worse after Marcos was ousted,Author not found,2020-07-08,FALSE
FACT CHECK: Imposibleng may 1.9 milyong toneladang ginto si Marcos sa China,Author not found,2023-01-09,FALSE
FACT CHECK: Video of Bella Hadid supporting Israel is AI-generated,Author not found,2023-11-06,FALSE
FALSE: Nurture's Well paragis organic capsule treats uterine illnesses,Author not found,2022-07-15,FALSE
FALSE: Gumamit ng military chopper si Robredo sa relief operation,Author not found,2022-01-31,FALSE
Ipinagbabawal ng Safe Spaces Act ang pagmumura sa konteksto ng public sexual harassment,Author not found,2022-09-02,MISSING CONTEXT
DSWD list identifies only potential social protection beneficiaries,Author not found,2022-08-15,MISSING CONTEXT
FALSE: Marcos family owns '$2 quadrillion' worth of gold,Author not found,2021-11-24,FALSE
FACT CHECK: GCash 'advisory' on Money Protect as refund feature is fake,Author not found,2024-02-28,FALSE
FALSE: Hindi nagkaroon ng posisyon sa Gabinete si Robredo,Author not found,2022-05-03,FALSE
FACT CHECK: Philippines has not received a warship from Russia,Author not found,2023-03-17,FALSE
FACT CHECK: Marcos didn't go to Japan to discuss 'Marcos Gold',Author not found,2023-02-17,FALSE
FACT CHECK: Job posts circulating online are fake â BIR,Author not found,2023-07-31,FALSE
"Barangay, SK polls have not been postponed",Author not found,2022-09-01,FALSE
FACT CHECK: US and PH Navy did not attack a Chinese Coast Guard ship,Author not found,2024-04-15,FALSE
FACT CHECK: 2022 video of 'upward lightning' misrepresented as occurring in Germany,Author not found,2023-09-26,FALSE
FACT CHECK: No US assault on China Coast Guard in East China Sea,Author not found,2023-10-02,FALSE
FACT CHECK: UP will not be closed down,Author not found,2023-03-01,FALSE
FALSE: Heart Keep cleanses blood vessels,Author not found,2022-07-08,FALSE
FACT CHECK: No camera tax imposed in the municipality of Lila in Bohol,Author not found,2023-10-05,FALSE
FALSE: Drinking water with meals dilutes gastric juices enough to affect digestion,Author not found,2022-03-15,FALSE
FACT CHECK: Philippines doesn't have the largest deuterium deposits in the world,Author not found,2023-04-05,FALSE
FACT CHECK: No confirmation of Philippine dates for Taylor Swift's 'Eras Tour',Author not found,2023-11-13,FALSE
FACT CHECK: DepEd has no 'Baon Program',Author not found,2024-01-12,FALSE
Video of aircraft releasing flares taken at Poland airshow,Author not found,2022-11-23,FALSE
FALSE: Photos showing Putin and Zelenskiy during the 2022 Russia-Ukraine crisis,Author not found,2022-03-10,FALSE
Sara Duterte posts photos of her giving aid to Filipinos,Author not found,2022-10-31,FALSE
FACT CHECK: No news of Chinese diplomats expelled from PH,Author not found,2024-05-15,FALSE
FACT CHECK: PH's projected 6% GDP growth for 2023 not ranked first in Asia,Author not found,2023-04-25,FALSE
FACT CHECK: The Philippines doesn't have a final deal to buy Gripen jet fighters,Author not found,2022-12-22,FALSE
FACT CHECK: TUPAD job posts offering P800 daily salary are fake â DOLE,Author not found,2024-02-16,FALSE
FACT CHECK: No Marcos-Duterte order for Vice Ganda to leave the country,Author not found,2023-10-16,FALSE
"FACT CHECK: Post warning about 6-day phone, internet outage is fake",Author not found,2023-11-26,FALSE
"FACT CHECK: Bill granting cash gifts to seniors aged 80, 90 not yet law",Author not found,2024-01-18,FALSE
"FALSE: Ayon sa Bombo Radyo Bacolod, 70M ang dumalo sa Leni-Kiko rally",Author not found,2022-03-15,FALSE
"FACT CHECK: Video shows New Zealand oil spill, not US attack on Chinese ship",Author not found,2023-09-20,FALSE
FACT CHECK: Leila de Lima's office operational even when she was in prison,Author not found,2023-11-23,FALSE
FACT CHECK: No US warship deployed to confront Chinese vessel in West Philippine Sea,Author not found,2023-05-10,FALSE
FACT CHECK: PAL not offering six months of free flights for P168,Author not found,2024-02-07,FALSE
FALSE: Marcos Jr. was 2001 Milo Little Olympics taekwondo champion,Author not found,2022-03-23,FALSE
"FACT CHECK: Video shows protest vs fast fashion, not Israel-Hamas war",Author not found,2023-12-18,FALSE
FALSE: Ex-Miss Ukraine Anastasiia Lenna joins military in fight against Russia,Author not found,2022-03-07,FALSE
FACT CHECK: DSWD's Unconditional Cash Transfer program ended in 2020,Author not found,2024-01-10,FALSE
FALSE: Lahat ng pinatay noong Martial Law ay komunista,Author not found,2022-03-20,FALSE
FALSE: Arthriheal Health Supplement treats arthritis,Author not found,2022-07-18,FALSE
"FACT CHECK: No P2,000 Women's Month cash gift from Landbank",Author not found,2024-03-25,FALSE
"FACT CHECK: House approved NCST, not mandatory ROTC",Author not found,2023-03-08,FALSE
FACT CHECK: Viral video of child rescue not from Israel-Hamas war,Author not found,2023-10-17,FALSE
The US CIA did not kidnap the Marcos family in 1986,Author not found,2022-09-21,FALSE
FACT CHECK: Sandro Marcos did not convert Bahay Pangarap into a nightclub,Author not found,2023-10-23,FALSE
FALSE: Namayapa na si Kris Aquino,Author not found,2022-06-30,FALSE
FALSE: Grandsure Gold Nutrient Dense Drink treats joint pain,Author not found,2022-07-18,FALSE
FACT CHECK: Marcos made no mention of 'Fuji Bank account' in departure speech,Author not found,2023-02-09,FALSE
Maymay is not a Super Typhoon,Author not found,2022-10-12,FALSE
"FACT CHECK: Imposible ang 1 bilyong toneladang ginto, 1 milyong toneladang platinum ni Marcos",Author not found,2022-12-20,FALSE
FALSE: Coca-Cola partners with WHO for investment program,Author not found,2022-02-07,FALSE
FACT CHECK: Old Photo Used To Make It Appear Duterte Is Supporting Moreno,Marc Jayson Cayabyab,2022-02-22,MISLEADING
"FACT CHECK: No reports of imminent Taal eruption, quake",Author not found,2023-07-26,FALSE
MISSING CONTEXT: Non-tax revenue constitutes 6% of the PH's total income,Author not found,2022-02-05,MISSING CONTEXT
FALSE: Lishou helps consumers lose weight in two weeks,Author not found,2022-06-27,FALSE
FACT CHECK: BSP didn't release a P150 bill featuring Jose Rizal,Author not found,2023-02-03,FALSE
"FALSE: Bilang ng bumoto kay Marcos sa HK noong Abril 10, ayon sa exit poll",Author not found,2022-04-12,FALSE
"FALSE: Ayon sa Guinness, pinakamalaki sa buong mundo ang Uniteam rally sa Cavite",Author not found,2022-03-30,FALSE
FALSE: Galunggong is the easiest fish to raise,Author not found,2022-03-10,FALSE
FALSE: Nakaprograma na ang magiging resulta ng botohan sa Mayo 2022,Author not found,2022-04-01,FALSE
FACT CHECK: Video of Duterte attending Quiboloy's birthday is from 2023,Author not found,2024-05-03,FALSE
FACT CHECK: Link for CHED-UniFast scholarship is fake,Author not found,2024-01-17,FALSE
FACT CHECK: The PH is not 2nd richest in gold deposits in the world,Author not found,2023-02-10,FALSE
FALSE: Si Tiburcio Marcos ay kandidato sa pagkapangulo,Author not found,2022-02-09,FALSE
"FACT CHECK: Indigent senior citizens entitled to P1,000 pension, not P12,000",Author not found,2024-03-13,FALSE
FACT CHECK: Malasakit Centers have no educational assistance program,Author not found,2024-05-21,FALSE
FACT CHECK: No official reports of Quiboloy death,Author not found,2024-06-05,FALSE
"FACT CHECK: Sara Duterte is still VP, DepEd secretary",Author not found,2024-02-09,FALSE
FACT CHECK: Online link for DSWD unemployment aid is fake,Author not found,2023-11-17,FALSE
Hindi sinabi ng mayor ng Midsayap na mawawalan ng kuryente sa North Cotabato,Author not found,2022-10-29,FALSE
MISSING CONTEXT: Si Marcos Jr. ang may-akda ng batas na nagtatag ng NYC,Author not found,2022-05-03,MISSING CONTEXT
Gluzabet Plus does not cure diabetes,Author not found,2022-08-05,FALSE
"Naghain ng subpoena ang Senado para kay Rodriguez, hindi para kay Marcos",Author not found,2022-09-13,FALSE
FACT CHECK: No prediction of looming magnitude 7 earthquake to hit Bohol,Author not found,2023-07-10,FALSE
FACT CHECK: US hasn't sent warships to the Philippines,Author not found,2023-04-11,UNAVAILABLE
FALSE: Phillip Salvador nagpasalamat sa tulong ni Marcos Jr. kay Kris Aquino,Author not found,2022-02-01,FALSE
KAMANDAG ni PBBM Military Exercise' is not the official name of the exercise,Author not found,2022-10-19,FALSE
FALSE: Comelec releases voter preference results all favoring Marcos Jr.,Author not found,2022-02-03,FALSE
FACT CHECK: Mga kasinungalingan tungkol sa Rappler-Comelec partnership,Author not found,2022-03-07,UNAVAILABLE
"FACT CHECK: Di totoo ang 'P7,000 ayuda' ng DSWD para sa mahihirap",Author not found,2023-10-16,FALSE
FACT CHECK: Philippine FDA debunks all-cure claims of Paragis herbal products,Author not found,2023-04-05,FALSE
FALSE: Hindi kailanman bumisita ang Amnesty International sa Pilipinas,Author not found,2022-03-24,FALSE
FACT CHECK: Video of 'US carriers' destroying 'Russian oil tanks' just a game simulation,Author not found,2023-01-06,FALSE
FACT CHECK: China can't host next ASEAN Summit,Author not found,2023-09-08,FALSE
FALSE: Makabayan lawmakers are communist guerillas' urban operatives,Author not found,2022-01-31,FALSE
FALSE: Marcos Jr. planong dayain kaya walang bantay sa pag-imprenta ng mga balota,Author not found,2022-03-26,FALSE
"FACT CHECK: Hindi magmumulta kung itutupi ang P1,000 peso bill",Author not found,2022-12-22,FALSE
FALSE: Kinopya ng South Korea at Singapore ang economic blueprint ni Marcos,Author not found,2022-04-22,FALSE
FACT CHECK: Video of China 'firing' at US ships cites fake CNN report,Author not found,2023-08-21,FALSE
FACT CHECK: China Coast Guard did not fire on PH Navy ship near Scarborough Shoal,Author not found,2023-10-14,FALSE
FACT CHECK: Vessel rescued by PH Coast Guard doesn't supply food to Chinese troops,Author not found,2023-02-13,FALSE
FACT CHECK: The Philippines has no Chinook helicopter factory,Author not found,2023-06-23,FALSE
"FACT CHECK: 2021 pa inilabas ang P5,000 bilang commemorative bill",Author not found,2022-12-22,FALSE
FACT CHECK: Kris Aquino Didn't Say Filipinos Owe Their Freedom To Dad Ninoy During Leni-Kiko Rally,Katrina Hallare,2022-03-29,MISLEADING
